J1: Juleøl testing - Julen 2004
A2: Navn | B2: Vekting | C2: Julebokk | D2: CB | E2: Lervig | F2: Ringnes | G2: Frydenlund | H2: Aas | I2: Mack | J2: Borg | K2: Nøgne Ø God Jul | L2: Nøgne Ø Julenatt | M2: Nøgne Ø Underlig Jul | N2: Dahls | O2: Fredrikstad | P2: Hansa | Q2: Fenalår A | R2: Fenalår B | S2: Fenalår C | T2: Snitt, person | V2: Antall | W2: Snitt person - ØL
A3: Alvin | B3: 1 | C3: 4 | D3: 3 | E3: 3 | F3: 4 | G3: 5 | H3: 4 | I3: 6 | J3: 2 | N3: 4 | O3: 4 | P3: 4 | Q3: 5 | R3: 3 | S3: 4 | T3: =AVERAGE(C3:S3) -> 3.9285714285714284 | V3: =COUNT(C3:S3) -> 14 | W3: =SUM(C3:P3)/COUNT(C3:P3) -> 3.9090909090909092
A4: Arnie | B4: 1 | C4: 5 | D4: 3 | F4: 4 | H4: 3 | I4: 4 | J4: 3 | P4: 4 | T4: b | V4: =COUNT(C4:S4) -> 7 | W4: =SUM(C4:P4)/COUNT(C4:P4) -> 3.7142857142857144
A5: Bård | B5: 1 | E5: 2 | G5: 4 | I5: 4 | J5: 5 | M5: 3 | N5: 4 | O5: 3 | Q5: 4 | R5: 5 | S5: 4 | T5: =AVERAGE(C5:S5) -> 3.8 | V5: =COUNT(C5:S5) -> 10 | W5: =SUM(C5:P5)/COUNT(C5:P5) -> 3.5714285714285716
A6: Cynthia | B6: 1 | C6: 4 | D6: 2 | E6: 3 | F6: 4 | G6: 6 | H6: 4 | I6: 6 | J6: 3 | N6: 4 | O6: 3 | P6: 5 | Q6: 5 | R6: 3 | S6: 4 | T6: =AVERAGE(C6:S6) -> 4 | V6: =COUNT(C6:S6) -> 14 | W6: =SUM(C6:P6)/COUNT(C6:P6) -> 4
A7: Dyveke | B7: 1 | D7: 3 | H7: 3 | I7: 4 | K7: 3 | N7: 4 | O7: 3 | P7: 5 | Q7: 4 | R7: 5 | S7: 4 | T7: =AVERAGE(C7:S7) -> 3.8 | V7: =COUNT(C7:S7) -> 10 | W7: =SUM(C7:P7)/COUNT(C7:P7) -> 3.5714285714285716
A8: Hein H | B8: 0.5 | D8: 4 | E8: 5 | M8: 1 | N8: 3 | O8: 5 | P8: 5 | T8: =AVERAGE(C8:S8) -> 3.8333333333333335 | V8: =COUNT(C8:S8) -> 6 | W8: =SUM(C8:P8)/COUNT(C8:P8) -> 3.8333333333333335
A9: Eirik T | B9: 0 | F9: 5 | I9: 3 | L9: 4 | O9: 5 | Q9: 2 | R9: 4 | S9: 5 | T9: =AVERAGE(C9:S9) -> 4 | V9: =COUNT(C9:S9) -> 7 | W9: =SUM(C9:P9)/COUNT(C9:P9) -> 4.25 | Y9: Tap av stemme 2003
A10: Hasse | B10: 0.5 | D10: b | P10: 5 | T10: =AVERAGE(C10:S10) -> 5 | V10: =COUNT(C10:S10) -> 1 | W10: =SUM(C10:P10)/COUNT(C10:P10) -> 5
A11: Kristin | B11: 0.5 | T11: =AVERAGE(C11:S11) -> #DIV/0! | V11: =COUNT(C11:S11) -> 0 | W11: =SUM(C11:P11)/COUNT(C11:P11) -> #DIV/0!
A12: Lars G | B12: 1 | C12: 4 | D12: 4 | F12: 4 | H12: 5 | J12: 4 | L12: 2 | N12: 3 | T12: =AVERAGE(C12:S12) -> 3.7142857142857144 | V12: =COUNT(C12:S12) -> 7 | W12: =SUM(C12:P12)/COUNT(C12:P12) -> 3.7142857142857144
A13: Gjertrud | B13: 1 | F13: 5 | I13: 4 | M13: 2 | N13: 4 | Q13: 6 | R13: 5 | S13: 5 | T13: =AVERAGE(C13:S13) -> 4.4285714285714288 | V13: =COUNT(C13:S13) -> 7 | W13: =SUM(C13:P13)/COUNT(C13:P13) -> 3.75
A14: Hanne Therese | B14: 1 | F14: 6 | H14: 2 | J14: 4 | K14: 2 | O14: 4 | P14: 4 | Q14: 2 | R14: 5 | S14: 4 | T14: =AVERAGE(C14:S14) -> 3.6666666666666665 | V14: =COUNT(C14:S14) -> 9 | W14: =SUM(C14:P14)/COUNT(C14:P14) -> 3.6666666666666665
A15: Harald Ø | B15: 1 | F15: 4 | H15: 2 | I15: 5 | N15: 4 | P15: 3 | T15: =AVERAGE(C15:S15) -> 3.6 | V15: =COUNT(C15:S15) -> 5 | W15: =SUM(C15:P15)/COUNT(C15:P15) -> 3.6
A16: Harald | B16: 1 | H16: 5 | I16: 4 | J16: 3 | K16: 2 | N16: 2 | P16: 4 | T16: =AVERAGE(C16:S16) -> 3.3333333333333335 | V16: =COUNT(C16:S16) -> 6 | W16: =SUM(C16:P16)/COUNT(C16:P16) -> 3.3333333333333335
A17: Janken | B17: 1 | E17: 2 | F17: 4 | G17: 5 | H17: 4 | I17: 5 | J17: 5 | K17: 1 | L17: 1 | M17: 1 | N17: 4 | Q17: 2 | R17: 5 | S17: 3 | T17: =AVERAGE(C17:S17) -> 3.2307692307692308 | V17: =COUNT(C17:S17) -> 13 | W17: =SUM(C17:P17)/COUNT(C17:P17) -> 3.2
A18: Kjetil JD | B18: 0.5 | C18: 5 | H18: 4 | J18: 4 | K18: 5 | P18: 4 | T18: =AVERAGE(C18:S18) -> 4.4 | V18: =COUNT(C18:S18) -> 5 | W18: =SUM(C18:P18)/COUNT(C18:P18) -> 4.4
A19: Marte | B19: 0.5 | T19: =AVERAGE(C19:S19) -> #DIV/0! | V19: =COUNT(C19:S19) -> 0 | W19: =SUM(C19:P19)/COUNT(C19:P19) -> #DIV/0!
A20: Eva | B20: 0.5 | F20: 3 | N20: 2 | P20: 3 | T20: =AVERAGE(C20:S20) -> 2.6666666666666665 | V20: =COUNT(C20:S20) -> 3 | W20: =SUM(C20:P20)/COUNT(C20:P20) -> 2.6666666666666665
A21: Nils-H | B21: 1 | C21: 3 | D21: 3 | F21: 4 | G21: 3 | H21: 3 | I21: 3 | J21: 3 | K21: 2 | N21: 4 | O21: 3 | P21: 3 | Q21: 5 | R21: 4 | S21: 4 | T21: =AVERAGE(C21:S21) -> 3.3571428571428572 | V21: =COUNT(C21:S21) -> 14 | W21: =SUM(C21:P21)/COUNT(C21:P21) -> 3.0909090909090908
A22: Petter | B22: 1 | C22: 4 | D22: 4 | F22: 6 | G22: 5 | H22: 4 | I22: 5 | J22: 4 | L22: 3 | M22: 2 | N22: 4 | O22: 4 | P22: 4 | Q22: 4 | R22: 1 | S22: 5 | T22: =AVERAGE(C22:S22) -> 3.9333333333333331 | V22: =COUNT(C22:S22) -> 15 | W22: =SUM(C22:P22)/COUNT(C22:P22) -> 4.083333333333333
A23: Trygve | B23: 0.5 | D23: 3 | J23: 4 | P23: 4 | T23: =AVERAGE(C23:S23) -> 3.6666666666666665 | V23: =COUNT(C23:S23) -> 3 | W23: =SUM(C23:P23)/COUNT(C23:P23) -> 3.6666666666666665
A24: Totto | B24: 1 | C24: 4 | D24: 3 | E24: 2 | F24: 5 | G24: 6 | H24: 3 | I24: 4 | J24: 4 | K24: 3 | L24: 3 | M24: 2 | N24: 4 | O24: 4 | P24: 5 | Q24: 4 | R24: 5 | S24: 3 | T24: =AVERAGE(C24:S24) -> 3.7647058823529411 | V24: =COUNT(C24:S24) -> 17 | W24: =SUM(C24:P24)/COUNT(C24:P24) -> 3.7142857142857144
A25: Tobias | B25: 0.5 | C25: 6 | D25: 3 | F25: 5 | G25: 4 | H25: 4 | I25: 4 | J25: 4 | K25: 1 | N25: 5 | O25: 5 | Q25: 4 | R25: 6 | S25: 3 | T25: =AVERAGE(C25:S25) -> 4.1538461538461542 | V25: =COUNT(C25:S25) -> 13 | W25: =SUM(C25:P25)/COUNT(C25:P25) -> 4.1
A26: Øyvind | B26: 1 | D26: 2 | F26: 3 | J26: 4 | L26: 4 | P26: 3 | T26: =AVERAGE(C26:S26) -> 3.2 | V26: =COUNT(C26:S26) -> 5 | W26: =SUM(C26:P26)/COUNT(C26:P26) -> 3.2
A27: Verinoca | B27: 0.5 | H27: 5 | I27: 3 | T27: =AVERAGE(C27:S27) -> 4 | V27: =COUNT(C27:S27) -> 2 | W27: =SUM(C27:P27)/COUNT(C27:P27) -> 4
A29: Vekt, juleøl | B29: =SUM(B3:B28) -> 19.5
A30: Antall stemmer | B30: =COUNT(B3:B28) -> 25 | C30: =COUNT(C3:C28) -> 9 | D30: =COUNT(D3:D28) -> 12 | E30: =COUNT(E3:E28) -> 6 | F30: =COUNT(F3:F28) -> 15 | G30: =COUNT(G3:G28) -> 8 | H30: =COUNT(H3:H28) -> 15 | I30: =COUNT(I3:I28) -> 15 | J30: =COUNT(J3:J28) -> 15 | K30: =COUNT(K3:K28) -> 8 | L30: =COUNT(L3:L28) -> 6 | M30: =COUNT(M3:M28) -> 6 | N30: =COUNT(N3:N28) -> 15 | O30: =COUNT(O3:O28) -> 11 | P30: =COUNT(P3:P28) -> 16 | Q30: =COUNT(Q3:Q28) -> 12 | R30: =COUNT(R3:R28) -> 12 | S30: =COUNT(S3:S28) -> 12 | T30: =COUNT(T3:T28) -> 22 | V30: =SUM(V3:V28) -> 193
A31: Uvektet snitt | C31: =AVERAGE(C3:C28) -> 4.333333333333333 | D31: =AVERAGE(D3:D28) -> 3.0833333333333335 | E31: =AVERAGE(E3:E28) -> 2.8333333333333335 | F31: =AVERAGE(F3:F28) -> 4.4 | G31: =AVERAGE(G3:G28) -> 4.75 | H31: =AVERAGE(H3:H28) -> 3.6666666666666665 | I31: =AVERAGE(I3:I28) -> 4.2666666666666666 | J31: =AVERAGE(J3:J28) -> 3.7333333333333334 | K31: =AVERAGE(K3:K28) -> 2.375 | L31: =AVERAGE(L3:L28) -> 2.8333333333333335 | M31: =AVERAGE(M3:M28) -> 1.8333333333333333 | N31: =AVERAGE(N3:N28) -> 3.6666666666666665 | O31: =AVERAGE(O3:O28) -> 3.9090909090909092 | P31: =AVERAGE(P3:P28) -> 4.0625 | Q31: =AVERAGE(Q3:Q28) -> 3.9166666666666665 | R31: =AVERAGE(R3:R28) -> 4.25 | S31: =AVERAGE(S3:S28) -> 4
A32: Vektet gjennomsnitt | C32: =SUMPRODUCT(B3:B28,C3:C28)/SUMPRODUCT(B3:B28,IF(ISNUMBER(C3:C28),1,0)) -> ##### | D32: =SUMPRODUCT(B3:B26,D3:D26)/SUMPRODUCT(B3:B26,IF(D3:D26<>0,1,0)) -> ##### | E32: =SUMPRODUCT(C3:C26,E3:E26)/SUMPRODUCT(C3:C26,IF(E3:E26<>0,1,0)) -> ##### | F32: =SUMPRODUCT(B3:B26,F3:F26)/SUMPRODUCT(B3:B26,IF(F3:F26<>0,1,0)) -> #VALUE! | G32: =SUMPRODUCT(B3:B26,G3:G26)/SUMPRODUCT(B3:B26,IF(G3:G26<>0,1,0)) -> ###### | H32: =SUMPRODUCT(B3:B26,H3:H26)/SUMPRODUCT(B3:B26,IF(H3:H26<>0,1,0)) -> ##### | I32: =SUMPRODUCT(C3:C26,I3:I26)/SUMPRODUCT(C3:C26,IF(I3:I26<>0,1,0)) -> ##### | J32: =SUMPRODUCT(B3:B26,J3:J26)/SUMPRODUCT(B3:B26,IF(J3:J26<>0,1,0)) -> ##### | K32: =SUMPRODUCT(B3:B26,K3:K26)/SUMPRODUCT(B3:B26,IF(K3:K26<>0,1,0)) -> #VALUE! | L32: =SUMPRODUCT(A3:A28,L3:L28)/SUMPRODUCT(A3:A28,IF(L3:L28<>0,1,0)) -> #VALUE! | M32: =SUMPRODUCT(B3:B28,M3:M28)/SUMPRODUCT(B3:B28,IF(M3:M28<>0,1,0)) -> #VALUE! | N32: =SUMPRODUCT(B3:B25,N3:N25)/SUMPRODUCT(B3:B25,IF(N3:N25<>0,1,0)) -> ##### | O32: =SUMPRODUCT(B3:B25,O3:O25)/SUMPRODUCT(B3:B25,IF(O3:O25<>0,1,0)) -> ###### | P32: =SUMPRODUCT(C3:C25,P3:P25)/SUMPRODUCT(C3:C25,IF(P3:P25<>0,1,0)) -> ###### | Q32: =SUMPRODUCT(A3:A25,Q3:Q25)/SUMPRODUCT(A3:A25,IF(Q3:Q25<>0,1,0)) -> #VALUE! | R32: =SUMPRODUCT(B3:B25,R3:R25)/SUMPRODUCT(B3:B25,IF(R3:R25<>0,1,0)) -> ##### | S32: =SUMPRODUCT(B3:B25,S3:S25)/SUMPRODUCT(C3:C25,IF(S3:S25<>0,1,0)) -> ##### | T32: =AVERAGE(T3:T27) -> #DIV/0!
A33: Plassering | C33: 3 | D33: 10 | E33: 11 | F33: 2 | G33: 1 | H33: 8 | I33: 4 | J33: 7 | K33: 13 | L33: 11 | M33: 14 | N33: 8 | O33: 6 | P33: 5
A36: Plassering