A1: Juleøltesten, 22. november 2003
A3: Navn | B3: Vekting | C3: Julebokk | D3: CB | E3: Schous | F3: Ringnes | G3: Frydenlund | H3: Aas | I3: Lervig | J3: Borg | K3: Nøgne ø | L3: Mack | M3: Dahls | N3: Fredrikstad | O3: Hansa | P3: Tou | Q3: Fenalår P | R3: Fenalår M | S3: Snitt, person | U3: Antall
A4: Alvin | B4: 1 | C4: 5 | D4: 2 | E4: 4 | F4: 1 | G4: 5 | H4: 5 | I4: 3 | J4: 5 | K4: 2 | L4: 4 | M4: 3 | N4: 4 | O4: 5 | Q4: 4 | R4: 5 | S4: =AVERAGE(C4:P4) -> 3.6923076923076925 | T4: =AVERAGE(C4:R4) -> 3.8 | U4: =COUNT(C4:P4) -> 13
A5: Andre | B5: 0.5 | D5: 2 | E5: 2 | H5: 4 | L5: 4 | M5: 5 | O5: 3 | Q5: 3 | R5: 4 | S5: =AVERAGE(C5:P5) -> 3.3333333333333335 | U5: =COUNT(C5:P5) -> 6
A6: Arnie | B6: 1 | C6: 4 | D6: 2 | E6: 4 | F6: 3 | G6: 3 | I6: 3 | J6: 4 | L6: 4 | M6: 2 | N6: 5 | O6: 4 | Q6: 4 | R6: 5 | S6: =AVERAGE(C6:P6) -> 3.4545454545454546 | U6: =COUNT(C6:P6) -> 11
A7: Arvid | B7: 0.5 | C7: 5 | D7: 4 | E7: 4 | F7: 2 | G7: 6 | J7: 3 | L7: 4 | N7: 3 | O7: 3 | Q7: 3 | R7: 3 | S7: =AVERAGE(C7:P7) -> 3.7777777777777777 | U7: =COUNT(C7:P7) -> 9
A8: Bård | B8: 1 | C8: 1 | E8: 4 | F8: 2 | G8: 5 | J8: 4 | K8: 5 | L8: 2 | M8: 4 | N8: 5 | O8: 2 | Q8: 4 | R8: 5 | S8: =AVERAGE(C8:P8) -> 3.4 | U8: =COUNT(C8:P8) -> 10
A9: Cynthia | B9: 1 | D9: 2 | E9: 3 | F9: 4 | G9: 2 | H9: 5 | I9: 5 | J9: 2 | K9: 2 | L9: 3 | M9: 1 | N9: 5 | O9: 5 | Q9: 4 | R9: 4 | S9: =AVERAGE(C9:P9) -> 3.25 | U9: =COUNT(C9:P9) -> 12
A10: Dyveke | B10: 1 | C10: 4 | E10: 4 | G10: 5 | I10: 2 | M10: 5 | O10: 4 | Q10: 4 | R10: 4 | S10: =AVERAGE(C10:P10) -> 4 | U10: =COUNT(C10:P10) -> 6
A11: Eirik L | B11: 1 | C11: 5 | D11: 3 | E11: 3 | F11: 3 | G11: 5 | I11: 3 | J11: 4 | K11: 4 | L11: 5 | M11: 4 | N11: 4 | O11: 5 | P11: 3 | Q11: 4 | R11: 3 | S11: =AVERAGE(C11:P11) -> 3.9230769230769229 | U11: =COUNT(C11:P11) -> 13
A12: Eirik T | B12: 0.5 | C12: 5 | E12: 4 | F12: 4 | G12: 4 | H12: 4 | I12: 4 | J12: 5 | Q12: 5 | R12: 5 | S12: =AVERAGE(C12:P12) -> 4.2857142857142856 | U12: =COUNT(C12:P12) -> 7 | W12: Tap av stemme
A13: Erik | B13: 0.5 | H13: 5 | S13: =AVERAGE(C13:P13) -> 5 | U13: =COUNT(C13:P13) -> 1
A14: Erik B | B14: 0.5 | D14: 2 | E14: 4 | F14: 4 | G14: 4 | H14: 5 | L14: 3 | N14: 2 | O14: 2 | Q14: 3 | R14: 5 | S14: =AVERAGE(C14:P14) -> 3.25 | U14: =COUNT(C14:P14) -> 8
A15: Gjertrud | B15: 1 | C15: 3 | D15: 4 | H15: 4 | J15: 4 | L15: 4 | Q15: 5 | R15: 5 | S15: =AVERAGE(C15:P15) -> 3.8 | U15: =COUNT(C15:P15) -> 5
A16: Harald Ø | B16: 0.5 | D16: 5 | E16: 4 | S16: =AVERAGE(C16:P16) -> 4.5 | U16: =COUNT(C16:P16) -> 2
A17: Harald | B17: 0.5 | C17: 3 | D17: 3 | E17: 4 | F17: 3 | G17: 4 | H17: 5 | J17: 4 | L17: 4 | O17: 3 | S17: =AVERAGE(C17:P17) -> 3.6666666666666665 | U17: =COUNT(C17:P17) -> 9
A18: Janken | B18: 1 | C18: 4 | D18: 3 | E18: 4 | F18: 4 | I18: 3 | J18: 3 | L18: 5 | N18: 3 | Q18: 4 | R18: 5 | S18: =AVERAGE(C18:P18) -> 3.625 | U18: =COUNT(C18:P18) -> 8
A19: Jarle | B19: 1 | D19: 3 | E19: 4 | F19: 3 | G19: 5 | I19: 3 | J19: 5 | L19: 4 | M19: 4 | N19: 5 | P19: 5 | Q19: 4 | R19: 4 | S19: =AVERAGE(C19:P19) -> 4.1 | U19: =COUNT(C19:P19) -> 10
A20: Kenneth | B20: 1 | D20: 2 | F20: 2 | G20: 3 | I20: 3 | J20: 4 | K20: 3 | L20: 3 | M20: 4 | N20: 4 | O20: 3 | Q20: 4 | R20: 4 | S20: =AVERAGE(C20:P20) -> 3.1 | U20: =COUNT(C20:P20) -> 10
A21: Knut Håkon | B21: 1 | C21: 5 | D21: 3 | E21: 4 | F21: 4 | G21: 5 | J21: 4 | L21: 5 | M21: 4 | N21: 3 | O21: 5 | P21: 5 | Q21: 4 | R21: 3 | S21: =AVERAGE(C21:P21) -> 4.2727272727272725 | U21: =COUNT(C21:P21) -> 11
A22: Marianne | B22: 0.5 | D22: 3 | H22: 5 | L22: 5 | M22: 4 | O22: 4 | Q22: 4 | R22: 4 | S22: =AVERAGE(C22:P22) -> 4.2 | U22: =COUNT(C22:P22) -> 5
A23: Morten | B23: 1 | D23: 3 | E23: 4 | F23: 4 | G23: 4 | H23: 4 | J23: 3 | K23: 3 | M23: 3 | N23: 3 | Q23: 4 | R23: 5 | S23: =AVERAGE(C23:P23) -> 3.4444444444444446 | U23: =COUNT(C23:P23) -> 9
A24: Petter | B24: 1 | C24: 4 | D24: 4 | E24: 5 | F24: 3 | G24: 4 | H24: 4 | I24: 4 | J24: 4 | L24: 5 | M24: 5 | N24: 5 | O24: 5 | Q24: 5 | R24: 5 | S24: =AVERAGE(C24:P24) -> 4.333333333333333 | U24: =COUNT(C24:P24) -> 12
A25: Silje | B25: 0.5 | F25: 3 | G25: 3 | I25: 4 | J25: 4 | L25: 4 | M25: 5 | N25: 5 | S25: =AVERAGE(C25:P25) -> 4 | U25: =COUNT(C25:P25) -> 7
A26: Tom | B26: 0.5 | I26: 3 | K26: 3 | Q26: 5 | R26: 5 | S26: =AVERAGE(C26:P26) -> 3 | U26: =COUNT(C26:P26) -> 2
A27: Totto | B27: 1 | C27: 4 | D27: 2 | E27: 4 | F27: 4 | G27: 4 | H27: 4 | I27: 3 | J27: 3 | K27: 4 | L27: 5 | M27: 5 | N27: 2 | O27: 2 | P27: 4 | Q27: 4 | R27: 3 | S27: =AVERAGE(C27:P27) -> 3.5714285714285716 | U27: =COUNT(C27:P27) -> 14
A28: X - Lars | B28: 1 | C28: 2 | D28: 3 | E28: 4 | G28: 3 | H28: 5 | J28: 4 | L28: 4 | S28: =AVERAGE(C28:P28) -> 3.5714285714285716 | U28: =COUNT(C28:P28) -> 7
A29: Øyvind | B29: 0.5 | C29: 4 | D29: 2 | F29: 3 | G29: 4 | I29: 2 | J29: 5 | K29: 4 | L29: 3 | Q29: 4 | R29: 5 | S29: =AVERAGE(C29:P29) -> 3.375 | U29: =COUNT(C29:P29) -> 8
A30: X-Arild | B30: 1 | C30: 5 | D30: 5 | F30: 4 | H30: 3 | J30: 4 | L30: 4 | N30: 2 | P30: 3 | S30: =AVERAGE(C30:P30) -> 3.75 | U30: =COUNT(C30:P30) -> 8
A32: Vekt, juleøl | B32: =COUNT(B4:B30) -> 27
A33: Antall stemmer | B33: =COUNT(B4:B30) -> 27 | C33: =COUNT(C4:C30) -> 16 | D33: =COUNT(D4:D30) -> 21 | E33: =COUNT(E4:E30) -> 19 | F33: =COUNT(F4:F30) -> 19 | G33: =COUNT(G4:G30) -> 19 | H33: =COUNT(H4:H30) -> 14 | I33: =COUNT(I4:I30) -> 14 | J33: =COUNT(J4:J30) -> 20 | K33: =COUNT(K4:K30) -> 9 | L33: =COUNT(L4:L30) -> 21 | M33: =COUNT(M4:M30) -> 15 | N33: =COUNT(N4:N30) -> 16 | O33: =COUNT(O4:O30) -> 15 | P33: =COUNT(P4:P30) -> 5 | Q33: =COUNT(Q4:Q30) -> 21 | R33: =COUNT(R4:R30) -> 21 | U33: =SUM(U4:U31) -> 223
A34: Uvektet snitt | C34: =AVERAGE(C4:C30) -> 3.9375 | D34: =AVERAGE(D4:D30) -> 2.9523809523809526 | E34: =AVERAGE(E4:E30) -> 3.8421052631578947 | F34: =AVERAGE(F4:F30) -> 3.1578947368421053 | G34: =AVERAGE(G4:G30) -> 4.1052631578947372 | H34: =AVERAGE(H4:H30) -> 4.4285714285714288 | I34: =AVERAGE(I4:I30) -> 3.2142857142857144 | J34: =AVERAGE(J4:J30) -> 3.9 | K34: =AVERAGE(K4:K30) -> 3.3333333333333335 | L34: =AVERAGE(L4:L30) -> 4 | M34: =AVERAGE(M4:M30) -> 3.8666666666666667 | N34: =AVERAGE(N4:N30) -> 3.75 | O34: =AVERAGE(O4:O30) -> 3.6666666666666665 | P34: =AVERAGE(P4:P30) -> 4 | Q34: =AVERAGE(Q4:Q30) -> 4.0476190476190474 | R34: =AVERAGE(R4:R30) -> 4.333333333333333
A35: Vektet gjennomsnitt | C35: =SUMPRODUCT(B4:B30,C4:C30)/SUMIF(C4:C30,">0",B4:B30) -> 3.8928571428571428 | D35: =SUMPRODUCT(B4:B30,D4:D30)/SUMIF(D4:D30,">0",B4:B30) -> 2.9428571428571431 | E35: =SUMPRODUCT(B4:B30,E4:E30)/SUMIF(E4:E30,">0",B4:B30) -> 3.875 | F35: =SUMPRODUCT(B4:B30,F4:F30)/SUMIF(F4:F30,">0",B4:B30) -> 3.15625 | G35: =SUMPRODUCT(B4:B30,G4:G30)/SUMIF(G4:G30,">0",B4:B30) -> 4.09375 | H35: =SUMPRODUCT(B4:B30,H4:H30)/SUMIF(H4:H30,">0",B4:B30) -> 4.3636363636363633 | I35: =SUMPRODUCT(B4:B30,I4:I30)/SUMIF(I4:I30,">0",B4:B30) -> 3.2083333333333335 | J35: =SUMPRODUCT(B4:B30,J4:J30)/SUMIF(J4:J30,">0",B4:B30) -> 3.8571428571428572 | K35: =SUMPRODUCT(B4:B30,K4:K30)/SUMIF(K4:K30,">0",B4:B30) -> 3.3125 | L35: =SUMPRODUCT(B4:B30,L4:L30)/SUMIF(L4:L30,">0",B4:B30) -> 4.0285714285714285 | M35: =SUMPRODUCT(B4:B30,M4:M30)/SUMIF(M4:M30,">0",B4:B30) -> 3.7777777777777777 | N35: =SUMPRODUCT(B4:B30,N4:N30)/SUMIF(N4:N30,">0",B4:B30) -> 3.7931034482758621 | O35: =SUMPRODUCT(B4:B30,O4:O30)/SUMIF(O4:O30,">0",B4:B30) -> 3.8 | P35: =SUMPRODUCT(B4:B30,P4:P30)/SUMIF(P4:P30,">0",B4:B30) -> 4 | Q35: =SUMPRODUCT(B4:B30,Q4:Q30)/SUMIF(Q4:Q30,">0",B4:B30) -> 4.0857142857142854 | R35: =SUMPRODUCT(B4:B30,R4:R30)/SUMIF(R4:R30,">0",B4:B30) -> 4.3142857142857141
A36: Plassering | C36: =RANK(C35,B35:P35) -> 5 | D36: =RANK(D35,B35:P35) -> 14 | E36: =RANK(E35,B35:P35) -> 6 | F36: =RANK(F35,B35:P35) -> 13 | G36: =RANK(G35,B35:P35) -> 2 | H36: =RANK(H35,B35:P35) -> 1 | I36: =RANK(I35,B35:P35) -> 12 | J36: =RANK(J35,B35:P35) -> 7 | K36: =RANK(K35,B35:P35) -> 11 | L36: =RANK(L35,B35:P35) -> 3 | M36: =RANK(M35,B35:P35) -> 10 | N36: =RANK(N35,B35:P35) -> 9 | O36: =RANK(O35,B35:P35) -> 8 | P36: =RANK(P35,B35:P35) -> 4 | Q36: ~~ | R36: ~~
A39: HT | B39: julebrus | C39: = 4